commit	avg_score	total_seconds	status	description
baseline	4661.62	128.6	keep	default PipelineConfig (all values at factory defaults)
5a81a84	4063.50	120.2	keep	increase node_cluster_eps 6->12: fewer components, much fewer unresolved terminals
1dabe18	4389.75	117.5	discard	increase crossing_center_blob_radius 4->6: worse on all images, over-merged crossings
99db8d8	4038.25	119.9	keep	increase pipe_seal_min_component_area 16->32: small but consistent improvement across all images
d83b11d	2796.00	112.5	keep	increase close kernels 5->9: MASSIVE win, all metrics improved 20-40%
a4b10b4	2019.38	109.6	keep	increase close kernels 9->13: another massive drop, -28% from prev, -57% from baseline
5c63def	2061.00	112.1	discard	increase min_edge_length_px 2->5: slightly worse, mixed results
d7bc3a4	2013.38	109.0	keep	increase terminal_match_distance_px 48->72: tiny improvement, resolved a few more terminals
4e3fc33	2023.38	107.7	discard	increase pipe_mask_min_component_area 16->32: mixed, some images worse
